{
  "schemaVersion": "1.0.0",
  "nationId": "russia",
  "exchangeId": "moex",
  "tickers": [
    {
      "tickerId": "ru-defense",
      "sectorName": "defense",
      "initialPrice": 150,
      "volatilityMultiplier": 1.2,
      "eventSensitivityWeights": {
        "military-conflict": 4.0,
        "sanctions-imposed": -1.5,
        "civil-unrest": -1.0,
        "trade-deal": 0.5,
        "tech-breakthrough": 0.5,
        "oil-disruption": 0.5,
        "regime-change": -1.5,
        "natural-disaster": -0.5
      }
    },
    {
      "tickerId": "ru-energy",
      "sectorName": "energy",
      "initialPrice": 260,
      "volatilityMultiplier": 1.3,
      "eventSensitivityWeights": {
        "oil-disruption": 5.0,
        "sanctions-imposed": -3.0,
        "military-conflict": 1.5,
        "trade-deal": 1.0,
        "tech-breakthrough": 0.0,
        "civil-unrest": -0.5,
        "regime-change": -2.0,
        "natural-disaster": -1.0
      }
    },
    {
      "tickerId": "ru-technology",
      "sectorName": "technology",
      "initialPrice": 45,
      "volatilityMultiplier": 1.3,
      "eventSensitivityWeights": {
        "tech-breakthrough": 3.0,
        "sanctions-imposed": -2.5,
        "trade-deal": 1.5,
        "civil-unrest": -1.0,
        "military-conflict": -0.5,
        "oil-disruption": -0.5,
        "regime-change": -2.0,
        "natural-disaster": -0.5
      }
    },
    {
      "tickerId": "ru-finance",
      "sectorName": "finance",
      "initialPrice": 90,
      "volatilityMultiplier": 1.4,
      "eventSensitivityWeights": {
        "civil-unrest": -3.0,
        "sanctions-imposed": -4.0,
        "trade-deal": 2.0,
        "regime-change": -3.5,
        "military-conflict": -1.5,
        "oil-disruption": -1.0,
        "tech-breakthrough": 0.0,
        "natural-disaster": -1.0
      }
    },
    {
      "tickerId": "ru-consumer",
      "sectorName": "consumer",
      "initialPrice": 55,
      "volatilityMultiplier": 1.2,
      "eventSensitivityWeights": {
        "military-conflict": -3.0,
        "civil-unrest": -2.0,
        "trade-deal": 2.0,
        "natural-disaster": -2.0,
        "sanctions-imposed": -2.0,
        "oil-disruption": -0.5,
        "tech-breakthrough": 0.0,
        "regime-change": -1.5
      }
    },
    {
      "tickerId": "ru-healthcare",
      "sectorName": "healthcare",
      "initialPrice": 30,
      "volatilityMultiplier": 1.0,
      "eventSensitivityWeights": {
        "natural-disaster": 2.0,
        "civil-unrest": -0.5,
        "military-conflict": 0.5,
        "tech-breakthrough": 0.5,
        "sanctions-imposed": -1.0,
        "trade-deal": 0.5,
        "oil-disruption": 0.0,
        "regime-change": -1.0
      }
    },
    {
      "tickerId": "ru-mining",
      "sectorName": "mining",
      "initialPrice": 180,
      "volatilityMultiplier": 1.1,
      "eventSensitivityWeights": {
        "sanctions-imposed": 1.0,
        "oil-disruption": 1.0,
        "natural-disaster": -1.0,
        "military-conflict": 0.5,
        "trade-deal": 0.5,
        "civil-unrest": -0.5,
        "tech-breakthrough": 0.0,
        "regime-change": -0.5
      }
    }
  ]
}
