{
  "schemaVersion": "1.0.0",
  "nationId": "syria",
  "exchangeId": "dse",
  "tickers": [
    {
      "tickerId": "sy-defense",
      "sectorName": "defense",
      "initialPrice": 15,
      "volatilityMultiplier": 1.5,
      "eventSensitivityWeights": {
        "military-conflict": 4.0,
        "sanctions-imposed": -1.5,
        "civil-unrest": -1.5,
        "trade-deal": 0.5,
        "tech-breakthrough": 0.0,
        "oil-disruption": 0.5,
        "regime-change": -2.5,
        "natural-disaster": -0.5
      }
    },
    {
      "tickerId": "sy-energy",
      "sectorName": "energy",
      "initialPrice": 25,
      "volatilityMultiplier": 1.5,
      "eventSensitivityWeights": {
        "oil-disruption": 4.5,
        "sanctions-imposed": -3.0,
        "military-conflict": 1.5,
        "trade-deal": 1.0,
        "tech-breakthrough": 0.0,
        "civil-unrest": -1.0,
        "regime-change": -2.5,
        "natural-disaster": -1.0
      }
    },
    {
      "tickerId": "sy-consumer",
      "sectorName": "consumer",
      "initialPrice": 10,
      "volatilityMultiplier": 1.4,
      "eventSensitivityWeights": {
        "military-conflict": -3.0,
        "civil-unrest": -2.5,
        "trade-deal": 2.0,
        "natural-disaster": -2.5,
        "sanctions-imposed": -2.0,
        "oil-disruption": -0.5,
        "tech-breakthrough": 0.0,
        "regime-change": -2.0
      }
    },
    {
      "tickerId": "sy-infrastructure",
      "sectorName": "infrastructure",
      "initialPrice": 30,
      "volatilityMultiplier": 1.4,
      "eventSensitivityWeights": {
        "natural-disaster": -3.5,
        "military-conflict": -2.5,
        "trade-deal": 1.0,
        "civil-unrest": -1.5,
        "sanctions-imposed": -1.0,
        "tech-breakthrough": 0.0,
        "oil-disruption": -0.5,
        "regime-change": -1.5
      }
    },
    {
      "tickerId": "sy-mining",
      "sectorName": "mining",
      "initialPrice": 18,
      "volatilityMultiplier": 1.3,
      "eventSensitivityWeights": {
        "sanctions-imposed": 1.5,
        "oil-disruption": 1.5,
        "natural-disaster": -1.5,
        "military-conflict": 0.5,
        "trade-deal": 0.5,
        "civil-unrest": -0.5,
        "tech-breakthrough": 0.0,
        "regime-change": -0.5
      }
    }
  ]
}
