{
  "schemaVersion": "1.0.0",
  "nationId": "china",
  "exchangeId": "sse",
  "tickers": [
    {
      "tickerId": "cn-defense",
      "sectorName": "defense",
      "initialPrice": 180,
      "volatilityMultiplier": 1.0,
      "eventSensitivityWeights": {
        "military-conflict": 3.0,
        "sanctions-imposed": -1.5,
        "civil-unrest": -1.0,
        "trade-deal": 0.5,
        "tech-breakthrough": 0.5,
        "oil-disruption": 0.0,
        "regime-change": -1.0,
        "natural-disaster": -0.5
      }
    },
    {
      "tickerId": "cn-energy",
      "sectorName": "energy",
      "initialPrice": 140,
      "volatilityMultiplier": 1.2,
      "eventSensitivityWeights": {
        "oil-disruption": 4.0,
        "sanctions-imposed": -2.5,
        "military-conflict": 1.0,
        "trade-deal": 1.0,
        "tech-breakthrough": 0.5,
        "civil-unrest": -0.5,
        "regime-change": -1.0,
        "natural-disaster": -1.0
      }
    },
    {
      "tickerId": "cn-technology",
      "sectorName": "technology",
      "initialPrice": 280,
      "volatilityMultiplier": 1.2,
      "eventSensitivityWeights": {
        "tech-breakthrough": 4.0,
        "sanctions-imposed": -2.5,
        "trade-deal": 1.5,
        "civil-unrest": -1.0,
        "military-conflict": -0.5,
        "oil-disruption": -0.5,
        "regime-change": -1.5,
        "natural-disaster": -0.5
      }
    },
    {
      "tickerId": "cn-finance",
      "sectorName": "finance",
      "initialPrice": 200,
      "volatilityMultiplier": 1.1,
      "eventSensitivityWeights": {
        "civil-unrest": -2.5,
        "sanctions-imposed": -3.5,
        "trade-deal": 2.0,
        "regime-change": -3.0,
        "military-conflict": -1.0,
        "oil-disruption": -0.5,
        "tech-breakthrough": 0.5,
        "natural-disaster": -1.0
      }
    },
    {
      "tickerId": "cn-consumer",
      "sectorName": "consumer",
      "initialPrice": 160,
      "volatilityMultiplier": 1.0,
      "eventSensitivityWeights": {
        "military-conflict": -2.5,
        "civil-unrest": -2.0,
        "trade-deal": 2.0,
        "natural-disaster": -2.0,
        "sanctions-imposed": -1.5,
        "oil-disruption": -0.5,
        "tech-breakthrough": 0.5,
        "regime-change": -1.0
      }
    },
    {
      "tickerId": "cn-healthcare",
      "sectorName": "healthcare",
      "initialPrice": 90,
      "volatilityMultiplier": 0.9,
      "eventSensitivityWeights": {
        "natural-disaster": 2.0,
        "civil-unrest": -0.5,
        "military-conflict": 0.5,
        "tech-breakthrough": 1.0,
        "sanctions-imposed": -1.0,
        "trade-deal": 0.5,
        "oil-disruption": 0.0,
        "regime-change": -0.5
      }
    },
    {
      "tickerId": "cn-infrastructure",
      "sectorName": "infrastructure",
      "initialPrice": 220,
      "volatilityMultiplier": 0.9,
      "eventSensitivityWeights": {
        "natural-disaster": -3.0,
        "military-conflict": -2.0,
        "trade-deal": 1.0,
        "civil-unrest": -1.0,
        "sanctions-imposed": -1.0,
        "tech-breakthrough": 0.5,
        "oil-disruption": -0.5,
        "regime-change": -0.5
      }
    },
    {
      "tickerId": "cn-mining",
      "sectorName": "mining",
      "initialPrice": 110,
      "volatilityMultiplier": 1.0,
      "eventSensitivityWeights": {
        "sanctions-imposed": 1.0,
        "oil-disruption": 1.0,
        "natural-disaster": -1.0,
        "military-conflict": 0.5,
        "trade-deal": 0.5,
        "civil-unrest": -0.5,
        "tech-breakthrough": 0.0,
        "regime-change": -0.5
      }
    }
  ]
}
