{
  "schemaVersion": "1.0.0",
  "nationId": "japan",
  "exchangeId": "tse",
  "tickers": [
    {
      "tickerId": "jp-defense",
      "sectorName": "defense",
      "initialPrice": 85,
      "volatilityMultiplier": 0.9,
      "eventSensitivityWeights": {
        "military-conflict": 3.0,
        "sanctions-imposed": -0.5,
        "civil-unrest": -0.5,
        "trade-deal": 0.5,
        "tech-breakthrough": 1.0,
        "oil-disruption": 0.0,
        "regime-change": -0.5,
        "natural-disaster": -1.0
      }
    },
    {
      "tickerId": "jp-energy",
      "sectorName": "energy",
      "initialPrice": 70,
      "volatilityMultiplier": 1.1,
      "eventSensitivityWeights": {
        "oil-disruption": 3.5,
        "sanctions-imposed": -2.0,
        "military-conflict": 0.5,
        "trade-deal": 1.0,
        "tech-breakthrough": 0.5,
        "civil-unrest": -0.5,
        "regime-change": -0.5,
        "natural-disaster": -1.5
      }
    },
    {
      "tickerId": "jp-technology",
      "sectorName": "technology",
      "initialPrice": 380,
      "volatilityMultiplier": 1.0,
      "eventSensitivityWeights": {
        "tech-breakthrough": 5.0,
        "sanctions-imposed": -1.5,
        "trade-deal": 1.5,
        "civil-unrest": -0.5,
        "military-conflict": -0.5,
        "oil-disruption": -0.5,
        "regime-change": -1.0,
        "natural-disaster": -1.0
      }
    },
    {
      "tickerId": "jp-finance",
      "sectorName": "finance",
      "initialPrice": 220,
      "volatilityMultiplier": 0.9,
      "eventSensitivityWeights": {
        "civil-unrest": -2.0,
        "sanctions-imposed": -2.5,
        "trade-deal": 2.0,
        "regime-change": -2.5,
        "military-conflict": -1.0,
        "oil-disruption": -0.5,
        "tech-breakthrough": 0.5,
        "natural-disaster": -1.5
      }
    },
    {
      "tickerId": "jp-consumer",
      "sectorName": "consumer",
      "initialPrice": 250,
      "volatilityMultiplier": 0.9,
      "eventSensitivityWeights": {
        "military-conflict": -2.0,
        "civil-unrest": -1.5,
        "trade-deal": 2.0,
        "natural-disaster": -2.5,
        "sanctions-imposed": -0.5,
        "oil-disruption": -0.5,
        "tech-breakthrough": 0.5,
        "regime-change": -0.5
      }
    },
    {
      "tickerId": "jp-healthcare",
      "sectorName": "healthcare",
      "initialPrice": 160,
      "volatilityMultiplier": 0.8,
      "eventSensitivityWeights": {
        "natural-disaster": 2.5,
        "civil-unrest": -0.5,
        "military-conflict": 0.5,
        "tech-breakthrough": 1.5,
        "sanctions-imposed": -0.5,
        "trade-deal": 0.5,
        "oil-disruption": 0.0,
        "regime-change": -0.5
      }
    },
    {
      "tickerId": "jp-infrastructure",
      "sectorName": "infrastructure",
      "initialPrice": 130,
      "volatilityMultiplier": 0.8,
      "eventSensitivityWeights": {
        "natural-disaster": -3.5,
        "military-conflict": -1.5,
        "trade-deal": 1.0,
        "civil-unrest": -0.5,
        "sanctions-imposed": -0.5,
        "tech-breakthrough": 0.5,
        "oil-disruption": -0.5,
        "regime-change": -0.5
      }
    },
    {
      "tickerId": "jp-mining",
      "sectorName": "mining",
      "initialPrice": 40,
      "volatilityMultiplier": 1.0,
      "eventSensitivityWeights": {
        "sanctions-imposed": 0.5,
        "oil-disruption": 1.0,
        "natural-disaster": -1.5,
        "military-conflict": 0.5,
        "trade-deal": 0.5,
        "civil-unrest": -0.5,
        "tech-breakthrough": 0.0,
        "regime-change": -0.5
      }
    }
  ]
}
